"Moravia Eagles, Christoffer Bjornsson"
"Moravia Eagles, Ben Holtby"
"Moravia Eagles, Aviad Ratzon"
"Moravia Eagles, Slappy McDoodle"
"Moravia Eagles, Zivan Zidek"
"Moravia Eagles, Potato Chips"
"Moravia Eagles, Nico Gross"
"Moravia Eagles, Boruvka Banananak"
"Moravia Eagles, Sasha Dangelchek"
"Moravia Eagles, Marek Vyskoc"
"Moravia Eagles, Marian Potoczny"
"Moravia Eagles, Brady McIntyre"
"Moravia Eagles, Ty Justice"
"Moravia Eagles, Andrej Doskocil"
"Moravia Eagles, Barak Obrana"
"Moravia Eagles, Dionyz Vyskoc"
"Moravia Eagles, Sachimo Zoidberg"
"Moravia Eagles, Ondrej Ravchitikov"
"Moravia Eagles, Mikhail Kladno"
"Moravia Eagles, Daniel Garland"
"Bohemia Lions, Bernik Vrzala"
"Bohemia Lions, Luke Thomason"
"Bohemia Lions, Soren Kierkegaard"
"Bohemia Lions, Jan Zacha"
"Bohemia Lions, DeMaricus Smyth"
"Bohemia Lions, Cameron Urbowicz"
"Bohemia Lions, Petr Mikulak"
"Bohemia Lions, Ruslan Zaporozhets"
"Bohemia Lions, Pierre-Luc Laflamme"
"Bohemia Lions, Sean Stevenson Jr."
"Bohemia Lions, David Vent"
"Bohemia Lions, Chris Partridge"
"Bohemia Lions, Johnny Yuma"
"Bohemia Lions, Tokek Takshak"
"Bohemia Lions, Dickie Pecker"
"Bohemia Lions, Travis Jeziak"
"Bohemia Lions, Walter White"
"Bohemia Lions, Petr Kolesnikovs"
"Bohemia Lions, Konstantin Voloshin"
"Bohemia Lions, Matej Stransky"
"Silesia Black Eagles, Alexander Zajac"
"Silesia Black Eagles, Aron Hernadivic"
"Silesia Black Eagles, Casimir Stevens"
"Silesia Black Eagles, Charlie Schieck"
"Silesia Black Eagles, David Kastrba"
"Silesia Black Eagles, Flash Gordon"
"Silesia Black Eagles, Jakub Novak"
"Silesia Black Eagles, Josef Kubinec"
"Silesia Black Eagles, Simothy Drunkebird"
"Silesia Black Eagles, Matej Elias"
"Silesia Black Eagles, Mikas Bieksa"
"Silesia Black Eagles, Mike Verminski"
"Silesia Black Eagles, Piotr Czerkawski"
"Silesia Black Eagles, Przemyslaw Brzeszczyczkiewicz"
"Silesia Black Eagles, Samee Iqbal"
"Silesia Black Eagles, Tauras Karazija"
"Silesia Black Eagles, Zalleras Szlerchek"
"Silesia Black Eagles, Krysztof Kowalski"
"Silesia Black Eagles, Vratislav Zbynek"
"Silesia Black Eagles, Jakub Trocheck"
"Kladno Lynx, Schnitinfritz Jagr"
"Kladno Lynx, Troy McClure III"
"Kladno Lynx, Kornel Kasparek"
"Kladno Lynx, Filip Zadina"
"Kladno Lynx, Michael Scarn"
"Kladno Lynx, Shouta Aizawa"
"Kladno Lynx, Alex Winters"
"Kladno Lynx, Ravyn Tedisko"
"Kladno Lynx, Radovan Hudec"
"Kladno Lynx, Noctis Caelum"
"Kladno Lynx, Barret McCarthy"
"Kladno Lynx, Grayson St. Raegan"
"Kladno Lynx, Jakob Hamr"
"Kladno Lynx, Georgette Pel"
"Kladno Lynx, Knox Booth"
"Kladno Lynx, Patrik Satan"
"Kladno Lynx, Cash Savage"
"Kladno Lynx, Merit Csonka"
"Kladno Lynx, Tomas Pylon"
"Kladno Lynx, Josef Novotny"